item,information
Glowing Mushrooms,"While exploring the forest, you encounter a cluster of glowing mushrooms. They emit a soft, enchanting light that reveals a hidden path leading to a mystical shrine."
Glowing Mushrooms,"While exploring the forest, you encounter a cluster of glowing mushrooms. They emit a soft, enchanting light that reveals a hidden path leading to a mystical shrine."
Glowing Mushrooms,You discover a patch of glowing mushrooms surrounded by a magical aura. 
Glowing Mushrooms,You discover a patch of glowing mushrooms surrounded by a magical aura. 
Starlight Berries,"While picking starlight berries, you encounter a mischievous forest spirit. The spirit challenges you to a riddle contest. If you succeed, you receive additional berries as a reward."
Enchanted Flowers,"As you explore deeper into the forest, you come across a field of enchanted flowers. Each flower possesses unique magical properties, offering you a choice between various buffs or debuffs."
Enchanted Flowers,"As you explore deeper into the forest, you come across a field of enchanted flowers. Each flower possesses unique magical properties, offering you a choice between various buffs or debuffs."
Enchanted Flowers,"While gathering enchanted flowers, you accidentally trigger a hidden trap set by a forest guardian."
Moonlit Apples,"In a secluded orchard bathed in moonlight, you discover a tree bearing ripe moonlit apples. "
Moonlit Apples,"In a secluded orchard bathed in moonlight, you discover a tree bearing ripe moonlit apples. "
Dragon Scale,"Deep within the forest, you encounter a slumbering dragon guarding its hoard of treasures."
Unicorn Horn,"While wandering through the forest, you stumble upon a unicorn grazing peacefully."
Unicorn Horn,"You track a mythical unicorn roaming the forest. "
Griffin Claw,"You encounter a fearsome griffin terrorizing the forest. "
Ancient Antler,"Tracking a legendary stag through the forest, you discover a hidden glade where ancient antlers lie scattered on the ground."
Ancient Antler,"Tracking a legendary stag through the forest, you discover a hidden glade where ancient antlers lie scattered on the ground."